{
	"version": 1,
	"id": "p-0123456789abcdef0123",
	"idempotencyKey": "run-17/step-2",
	"changeHash": "sha256:cdcdcdcdcdcdcdcdcdcdcdcdcdcdcdcdcdcdcdcdcdcdcdcdcdcdcdcdcdcdcdcd",
	"space": "main",
	"area": "handbook",
	"state": "pending",
	"change": {
		"op": "update",
		"doc": "handbook/deploy/rollback",
		"baseHash": "sha256:9f2c1a7b0d3e5f60718293a4b5c6d7e8f90a1b2c3d4e5f60718293a4b5c6d7e8",
		"content": "---\ntype: runbook\ntitle: Rolling back\n---\nRoll back with the previous release tag.\n"
	},
	"diff": "--- a/deploy/rollback.md\n+++ b/deploy/rollback.md\n@@ -1,3 +1,4 @@\n type: runbook\n",
	"rationale": "The release tag procedure changed in October.",
	"evidence": [
		{
			"kind": "document",
			"ref": "handbook/deploy/releases",
			"contentHash": "sha256:efefefefefefefefefefefefefefefefefefefefefefefefefefefefefefefef",
			"excerpt": "Tags are cut from main."
		},
		{
			"kind": "text",
			"ref": "chat 2026-10-29"
		}
	],
	"provenance": {
		"version": 1,
		"origin": "agent-inferred",
		"space": "main",
		"plugin": "knowledge",
		"agent": {
			"kind": "agent",
			"id": "ada"
		},
		"principal": "human:ada",
		"session": "run-17",
		"traceId": "0a1b2c3d4e5f60718293a4b5c6d7e8f9",
		"observedAt": "2026-11-02T10:15:00.000Z",
		"validFrom": "2026-11-01T00:00:00.000Z",
		"validUntil": null,
		"confidence": 0.7,
		"authority": "handbook",
		"sources": [
			{
				"resource": "/handbook/deploy/rollback"
			}
		],
		"generated": null,
		"contentHash": "sha256:9f2c1a7b0d3e5f60718293a4b5c6d7e8f90a1b2c3d4e5f60718293a4b5c6d7e8",
		"derivedFrom": null,
		"access": ["space"],
		"sensitivity": "internal"
	},
	"policy": {
		"area": "handbook",
		"version": "sha256:1212121212121212121212121212121212121212121212121212121212121212",
		"rule": "person"
	},
	"exception": null,
	"proposer": {
		"actor": {
			"kind": "agent",
			"id": "ada"
		},
		"principal": "human:ada",
		"run": "run-17"
	},
	"confidence": 0.7,
	"decision": null,
	"result": null,
	"flags": [],
	"createdAt": "2026-11-02T10:15:00.000Z",
	"updatedAt": "2026-11-02T10:15:00.000Z"
}
